{
  "$schema": "https://raw.githubusercontent.com/pawcoding/RandomSaber/main/packs/.pack.schema.json",
  "id": "rocket",
  "title": "Rocket League Ã— Monstercat",
  "type": "ADDON",
  "img": "https://beatsaber.com/images/music/music6.jpg",
  "songs": [
    {
      "title": "Glide",
      "modes": {
        "twoSabers": 11111,
        "oneSaber": 0,
        "noArrows": 0,
        "full": 10000,
        "quarter": 10000
      }
    },
    {
      "title": "LUV U NEED U",
      "modes": {
        "twoSabers": 11111,
        "oneSaber": 0,
        "noArrows": 0,
        "full": 100,
        "quarter": 100
      }
    },
    {
      "title": "PLAY",
      "modes": {
        "twoSabers": 11111,
        "oneSaber": 11010,
        "noArrows": 0,
        "full": 0,
        "quarter": 0
      }
    },
    {
      "title": "ROCK IT",
      "modes": {
        "twoSabers": 11111,
        "oneSaber": 0,
        "noArrows": 0,
        "full": 0,
        "quarter": 0
      }
    },
    {
      "title": "Shiawese",
      "modes": {
        "twoSabers": 11111,
        "oneSaber": 0,
        "noArrows": 0,
        "full": 0,
        "quarter": 0
      }
    },
    {
      "title": "Test Me",
      "modes": {
        "twoSabers": 11111,
        "oneSaber": 0,
        "noArrows": 0,
        "full": 0,
        "quarter": 0
      }
    }
  ]
}
