{
  "id": "timbaland",
  "title": "Timbaland",
  "type": "ADDON",
  "img": "https://beatsaber.com/images/music/music8.jpg",
  "songs": [
    {
      "title": "Dumb Thingz",
      "modes": {
        "twoSabers": 11111,
        "oneSaber": 0,
        "noArrows": 0,
        "full": 0,
        "quarter": 0
      }
    },
    {
      "title": "Famous",
      "modes": {
        "twoSabers": 11111,
        "oneSaber": 0,
        "noArrows": 0,
        "full": 0,
        "quarter": 0
      }
    },
    {
      "title": "Has A Meaning",
      "modes": {
        "twoSabers": 11111,
        "oneSaber": 0,
        "noArrows": 0,
        "full": 100,
        "quarter": 100
      }
    },
    {
      "title": "What I Like",
      "modes": {
        "twoSabers": 11111,
        "oneSaber": 0,
        "noArrows": 0,
        "full": 0,
        "quarter": 0
      }
    },
    {
      "title": "While We're Young",
      "modes": {
        "twoSabers": 11111,
        "oneSaber": 11010,
        "noArrows": 0,
        "full": 0,
        "quarter": 0
      }
    }
  ]
}
