{
  "$schema": "https://raw.githubusercontent.com/pawcoding/RandomSaber/main/packs/.pack.schema.json",
  "id": "lizzo",
  "title": "Lizzo",
  "type": "ADDON",
  "img": "https://beatsaber.com/images/music/music19.jpg",
  "songs": [
    {
      "title": "2 Be Loved",
      "modes": {
        "twoSabers": 11111,
        "oneSaber": 0,
        "noArrows": 0,
        "full": 0,
        "quarter": 0
      }
    },
    {
      "title": "About Damn Time",
      "modes": {
        "twoSabers": 11111,
        "oneSaber": 0,
        "noArrows": 0,
        "full": 0,
        "quarter": 0
      }
    },
    {
      "title": "Cuz I Love You",
      "modes": {
        "twoSabers": 11111,
        "oneSaber": 0,
        "noArrows": 0,
        "full": 0,
        "quarter": 0
      }
    },
    {
      "title": "Everybody's Gay",
      "modes": {
        "twoSabers": 11111,
        "oneSaber": 0,
        "noArrows": 0,
        "full": 0,
        "quarter": 0
      }
    },
    {
      "title": "Good As Hell",
      "modes": {
        "twoSabers": 11111,
        "oneSaber": 0,
        "noArrows": 0,
        "full": 0,
        "quarter": 0
      }
    },
    {
      "title": "Juice",
      "modes": {
        "twoSabers": 11111,
        "oneSaber": 0,
        "noArrows": 0,
        "full": 0,
        "quarter": 0
      }
    },
    {
      "title": "Tempo",
      "modes": {
        "twoSabers": 11111,
        "oneSaber": 0,
        "noArrows": 0,
        "full": 0,
        "quarter": 0
      }
    },
    {
      "title": "Truth Hurts",
      "modes": {
        "twoSabers": 11111,
        "oneSaber": 0,
        "noArrows": 0,
        "full": 0,
        "quarter": 0
      }
    },
    {
      "title": "Worship",
      "modes": {
        "twoSabers": 11111,
        "oneSaber": 0,
        "noArrows": 0,
        "full": 0,
        "quarter": 0
      }
    }
  ]
}
