{
  "$schema": "https://raw.githubusercontent.com/pawcoding/RandomSaber/main/packs/.pack.schema.json",
  "id": "linkin",
  "title": "Linkin Park",
  "type": "ADDON",
  "img": "https://beatsaber.com/images/music/music9.jpg",
  "songs": [
    {
      "title": "Bleed It Out",
      "modes": {
        "twoSabers": 11111,
        "oneSaber": 0,
        "noArrows": 0,
        "full": 0,
        "quarter": 0
      }
    },
    {
      "title": "Breaking the Habit",
      "modes": {
        "twoSabers": 11111,
        "oneSaber": 0,
        "noArrows": 0,
        "full": 0,
        "quarter": 0
      }
    },
    {
      "title": "Faint",
      "modes": {
        "twoSabers": 11111,
        "oneSaber": 0,
        "noArrows": 0,
        "full": 0,
        "quarter": 0
      }
    },
    {
      "title": "Given Up",
      "modes": {
        "twoSabers": 11111,
        "oneSaber": 0,
        "noArrows": 0,
        "full": 0,
        "quarter": 0
      }
    },
    {
      "title": "In the End",
      "modes": {
        "twoSabers": 11111,
        "oneSaber": 0,
        "noArrows": 0,
        "full": 0,
        "quarter": 0
      }
    },
    {
      "title": "New Divide",
      "modes": {
        "twoSabers": 11111,
        "oneSaber": 0,
        "noArrows": 0,
        "full": 0,
        "quarter": 0
      }
    },
    {
      "title": "Numb",
      "modes": {
        "twoSabers": 11111,
        "oneSaber": 0,
        "noArrows": 0,
        "full": 0,
        "quarter": 0
      }
    },
    {
      "title": "One Step Closer",
      "modes": {
        "twoSabers": 11111,
        "oneSaber": 0,
        "noArrows": 0,
        "full": 0,
        "quarter": 0
      }
    },
    {
      "title": "Papercut",
      "modes": {
        "twoSabers": 11111,
        "oneSaber": 0,
        "noArrows": 0,
        "full": 0,
        "quarter": 0
      }
    },
    {
      "title": "Somewhere I Belong",
      "modes": {
        "twoSabers": 11111,
        "oneSaber": 0,
        "noArrows": 0,
        "full": 0,
        "quarter": 0
      }
    },
    {
      "title": "What I've Done",
      "modes": {
        "twoSabers": 11111,
        "oneSaber": 0,
        "noArrows": 0,
        "full": 0,
        "quarter": 0
      }
    }
  ]
}
