{
  "$schema": "https://raw.githubusercontent.com/pawcoding/RandomSaber/angular_setup/packs/.pack.schema.json",
  "id": "bts",
  "title": "BTS",
  "type": "ADDON",
  "img": "https://beatsaber.com/images/music/music10.jpg",
  "songs": [
    {
      "title": "Blood Sweat & Tears",
      "modes": {
        "twoSabers": 11111,
        "oneSaber": 0,
        "noArrows": 0,
        "full": 0,
        "quarter": 0
      }
    },
    {
      "title": "Boy With Luv",
      "modes": {
        "twoSabers": 11111,
        "oneSaber": 0,
        "noArrows": 0,
        "full": 0,
        "quarter": 0
      }
    },
    {
      "title": "Burning Up",
      "modes": {
        "twoSabers": 11111,
        "oneSaber": 0,
        "noArrows": 0,
        "full": 0,
        "quarter": 0
      }
    },
    {
      "title": "Dionysus",
      "modes": {
        "twoSabers": 11111,
        "oneSaber": 0,
        "noArrows": 0,
        "full": 0,
        "quarter": 0
      }
    },
    {
      "title": "DNA",
      "modes": {
        "twoSabers": 11111,
        "oneSaber": 0,
        "noArrows": 0,
        "full": 0,
        "quarter": 0
      }
    },
    {
      "title": "Dope",
      "modes": {
        "twoSabers": 11111,
        "oneSaber": 0,
        "noArrows": 0,
        "full": 0,
        "quarter": 0
      }
    },
    {
      "title": "Dynamite",
      "modes": {
        "twoSabers": 11111,
        "oneSaber": 0,
        "noArrows": 0,
        "full": 0,
        "quarter": 0
      }
    },
    {
      "title": "Fake Love",
      "modes": {
        "twoSabers": 11111,
        "oneSaber": 0,
        "noArrows": 0,
        "full": 0,
        "quarter": 0
      }
    },
    {
      "title": "IDOL",
      "modes": {
        "twoSabers": 11111,
        "oneSaber": 0,
        "noArrows": 0,
        "full": 0,
        "quarter": 0
      }
    },
    {
      "title": "Mic Drop",
      "modes": {
        "twoSabers": 11111,
        "oneSaber": 0,
        "noArrows": 0,
        "full": 0,
        "quarter": 0
      }
    },
    {
      "title": "Not Today",
      "modes": {
        "twoSabers": 11111,
        "oneSaber": 0,
        "noArrows": 0,
        "full": 0,
        "quarter": 0
      }
    },
    {
      "title": "UGH!",
      "modes": {
        "twoSabers": 11111,
        "oneSaber": 0,
        "noArrows": 0,
        "full": 0,
        "quarter": 0
      }
    }
  ]
}
